{
  "request_id": "913fe5fb-9662-4ff4-8ff5-474871762d10",
  "produced_at_utc": "2026-04-08T12:57:10Z",
  "scanner_status": "pending",
  "contract_version": "1.0.0",
  "candidate_outputs": [
    {
      "symbol": "BRIDGE_OPAQUE_CANDIDATE_REF",
      "row_status": "deferred",
      "omission_reason": "bridge_T95_placeholder_not_a_scan_opaque_candidate_ref"
    }
  ],
  "warnings": [
    "T96 mechanical bridge output only \u2014 not a universe scanner execution."
  ]
}
