{
  "request_id": "c4c61b02-b5eb-4836-8458-564f69e15b49",
  "produced_at_utc": "2026-04-10T15:37:42Z",
  "scanner_status": "pending",
  "contract_version": "1.0.0",
  "candidate_outputs": [
    {
      "symbol": "BRIDGE_OPAQUE_CANDIDATE_REF",
      "row_status": "deferred",
      "omission_reason": "bridge_T95_placeholder_not_a_scan_opaque_candidate_ref"
    }
  ],
  "warnings": [
    "T96 mechanical bridge output only \u2014 not a universe scanner execution."
  ]
}
